{
  "$schema": "https://json-schema.org/draft/2020-12/schema",
  "$id": "https://forgeops.invalid/contracts/forgeops-phase1-safety/1.0/schema.json",
  "title": "ForgeOps Phase 1 Safety Registry",
  "type": "object",
  "additionalProperties": false,
  "required": ["suite_id", "suite_version", "phase_id", "freshness_seconds", "registrations", "subsets"],
  "properties": {
    "suite_id": {"const": "forgeops-phase1-safety-v1"},
    "suite_version": {"const": "1.0"},
    "phase_id": {"const": "phase-1-safety"},
    "freshness_seconds": {"const": 300},
    "registrations": {
      "type": "array",
      "minItems": 23,
      "maxItems": 23,
      "items": {"$ref": "#/$defs/registration"}
    },
    "subsets": {
      "type": "object",
      "additionalProperties": false,
      "required": ["security_negative", "required_evidence"],
      "properties": {
        "security_negative": {"type": "array", "minItems": 20, "maxItems": 20, "uniqueItems": true, "items": {"$ref": "#/$defs/commandId"}},
        "required_evidence": {"type": "array", "minItems": 19, "maxItems": 19, "uniqueItems": true, "items": {"$ref": "#/$defs/commandId"}}
      }
    }
  },
  "$defs": {
    "relativeRef": {"type": "string", "pattern": "^(?!/)(?![A-Za-z]:[\\\\/])(?!.*(?:^|/)\\.\\.(?:/|$))(?!.*[\\\\*?]).+$"},
    "sha256": {"type": "string", "pattern": "^[0-9a-f]{64}$"},
    "utc": {"type": "string", "pattern": "^\\d{4}-\\d{2}-\\d{2}T\\d{2}:\\d{2}:\\d{2}Z$"},
    "tier": {"enum": ["E0", "E1", "E2", "E3"]},
    "commandId": {"type": "string", "pattern": "^[a-z][a-z0-9-]+$"},
    "hashBinding": {
      "type": "object",
      "additionalProperties": false,
      "required": ["field", "mode", "refs"],
      "properties": {
        "field": {"type": "string", "pattern": "^[a-z][a-z0-9_]*(?:\\.[a-z][a-z0-9_]*)*$"},
        "mode": {"enum": ["blob", "artifact", "framed"]},
        "refs": {"type": "array", "minItems": 1, "uniqueItems": true, "items": {"$ref": "#/$defs/relativeRef"}}
      }
    },
    "registration": {
      "type": "object",
      "additionalProperties": false,
      "required": ["gate_id", "profile_id", "command_id", "artifact_ref", "required_tier", "observed_at_field", "input_bindings"],
      "properties": {
        "gate_id": {"type": "string", "pattern": "^VG-[0-9]{3}$"},
        "profile_id": {"type": "string", "pattern": "^forgeops-[a-z0-9-]+$"},
        "command_id": {"$ref": "#/$defs/commandId"},
        "artifact_ref": {"$ref": "#/$defs/relativeRef"},
        "required_tier": {"$ref": "#/$defs/tier"},
        "observed_at_field": {"enum": ["observed_at", "time"]},
        "input_bindings": {"type": "array", "minItems": 1, "uniqueItems": true, "items": {"$ref": "#/$defs/hashBinding"}}
      }
    },
    "sourceIdentity": {
      "type": "object",
      "additionalProperties": false,
      "required": ["repository", "repository_id", "default_branch", "workflow_ref", "source_sha", "workflow_sha", "run_id", "run_attempt"],
      "properties": {
        "repository": {"type": "string", "pattern": "^[A-Za-z0-9][A-Za-z0-9._-]*/[A-Za-z0-9][A-Za-z0-9._-]*$"},
        "repository_id": {"type": "string", "pattern": "^[1-9][0-9]*$"},
        "default_branch": {"type": "string", "pattern": "^[A-Za-z0-9][A-Za-z0-9._/-]*$"},
        "workflow_ref": {"type": "string", "pattern": "^refs/heads/[A-Za-z0-9][A-Za-z0-9._/-]*$"},
        "source_sha": {"type": "string", "pattern": "^[0-9a-f]{40}$"},
        "workflow_sha": {"type": "string", "pattern": "^[0-9a-f]{40}$"},
        "run_id": {"type": "string", "pattern": "^[1-9][0-9]*$"},
        "run_attempt": {"type": "integer", "minimum": 1}
      }
    },
    "effectCounters": {
      "type": "object",
      "additionalProperties": false,
      "required": ["unauthorized_executions", "approval_bypasses", "containment_or_egress_escapes", "injection_acceptances", "raw_secret_occurrences", "cleanup_failures", "evidence_integrity_failures", "external_writes"],
      "properties": {
        "unauthorized_executions": {"type": "integer", "minimum": 0},
        "approval_bypasses": {"type": "integer", "minimum": 0},
        "containment_or_egress_escapes": {"type": "integer", "minimum": 0},
        "injection_acceptances": {"type": "integer", "minimum": 0},
        "raw_secret_occurrences": {"type": "integer", "minimum": 0},
        "cleanup_failures": {"type": "integer", "minimum": 0},
        "evidence_integrity_failures": {"type": "integer", "minimum": 0},
        "external_writes": {"type": "integer", "minimum": 0}
      }
    },
    "summary": {
      "type": "object",
      "additionalProperties": false,
      "required": ["total", "passed", "failed", "blockers"],
      "properties": {
        "total": {"type": "integer", "minimum": 0},
        "passed": {"type": "integer", "minimum": 0},
        "failed": {"type": "integer", "minimum": 0},
        "blockers": {"type": "integer", "minimum": 0}
      }
    },
    "blocker": {
      "type": "object",
      "additionalProperties": false,
      "required": ["gate_id", "command_id", "reason_code"],
      "properties": {
        "gate_id": {"type": "string", "pattern": "^VG-[0-9]{3}$"},
        "command_id": {"$ref": "#/$defs/commandId"},
        "reason_code": {"type": "string", "pattern": "^[A-Z][A-Z0-9_]+$"}
      }
    },
    "gateRow": {
      "type": "object",
      "additionalProperties": false,
      "required": ["gate_id", "profile_id", "command_id", "artifact_ref", "required_tier", "observed_tier", "status", "observed_at", "source_current", "public_safe", "blocker_codes"],
      "properties": {
        "gate_id": {"type": "string", "pattern": "^VG-[0-9]{3}$"},
        "profile_id": {"type": "string", "pattern": "^forgeops-[a-z0-9-]+$"},
        "command_id": {"$ref": "#/$defs/commandId"},
        "artifact_ref": {"$ref": "#/$defs/relativeRef"},
        "required_tier": {"$ref": "#/$defs/tier"},
        "observed_tier": {"anyOf": [{"$ref": "#/$defs/tier"}, {"type": "null"}]},
        "status": {"enum": ["PASSED", "FAILED", "NOT_RUN"]},
        "observed_at": {"anyOf": [{"$ref": "#/$defs/utc"}, {"type": "null"}]},
        "source_current": {"type": "boolean"},
        "public_safe": {"type": "boolean"},
        "blocker_codes": {"type": "array", "uniqueItems": true, "items": {"type": "string", "pattern": "^[A-Z][A-Z0-9_]+$"}}
      }
    },
    "reducerResult": {
      "type": "object",
      "additionalProperties": false,
      "required": ["result_version", "phase_id", "profile_id", "command_id", "status", "evidence_tier", "source_identity", "validated_at", "registry_sha256", "summary", "effect_counters", "gates", "blockers"],
      "properties": {
        "result_version": {"const": "1.0"},
        "phase_id": {"const": "phase-1-safety"},
        "profile_id": {"const": "forgeops-phase1-safety"},
        "command_id": {"enum": ["phase1-security-negative", "phase1-evidence-freshness"]},
        "status": {"enum": ["PASSED", "FAILED"]},
        "evidence_tier": {"const": "E3"},
        "source_identity": {"$ref": "#/$defs/sourceIdentity"},
        "validated_at": {"$ref": "#/$defs/utc"},
        "registry_sha256": {"$ref": "#/$defs/sha256"},
        "summary": {"$ref": "#/$defs/summary"},
        "effect_counters": {"$ref": "#/$defs/effectCounters"},
        "gates": {"type": "array", "items": {"$ref": "#/$defs/gateRow"}},
        "blockers": {"type": "array", "items": {"$ref": "#/$defs/blocker"}}
      }
    },
    "gateResult": {
      "type": "object",
      "additionalProperties": false,
      "required": ["result_version", "phase_id", "profile_id", "command_id", "status", "evidence_tier", "source_identity", "validated_at", "registry_sha256", "summary", "effect_counters", "gates", "blockers"],
      "properties": {
        "result_version": {"const": "1.0"},
        "phase_id": {"const": "phase-1-safety"},
        "profile_id": {"const": "forgeops-phase1-safety"},
        "command_id": {"const": "phase1-safety-gate"},
        "status": {"enum": ["READY", "NOT_READY"]},
        "evidence_tier": {"const": "E3"},
        "source_identity": {"$ref": "#/$defs/sourceIdentity"},
        "validated_at": {"$ref": "#/$defs/utc"},
        "registry_sha256": {"$ref": "#/$defs/sha256"},
        "summary": {"$ref": "#/$defs/summary"},
        "effect_counters": {"$ref": "#/$defs/effectCounters"},
        "gates": {"type": "array", "items": {"$ref": "#/$defs/gateRow"}},
        "blockers": {"type": "array", "items": {"$ref": "#/$defs/blocker"}}
      }
    },
    "manifestFile": {
      "type": "object",
      "additionalProperties": false,
      "required": ["path", "sha256", "bytes"],
      "properties": {
        "path": {"$ref": "#/$defs/relativeRef"},
        "sha256": {"$ref": "#/$defs/sha256"},
        "bytes": {"type": "integer", "minimum": 1}
      }
    },
    "artifactManifest": {
      "type": "object",
      "additionalProperties": false,
      "required": ["payload_version", "status", "created_at", "source_identity", "files"],
      "properties": {
        "payload_version": {"const": "phase1-safety-1.0"},
        "status": {"const": "READY"},
        "created_at": {"$ref": "#/$defs/utc"},
        "source_identity": {"$ref": "#/$defs/sourceIdentity"},
        "files": {"type": "array", "minItems": 1, "uniqueItems": true, "items": {"$ref": "#/$defs/manifestFile"}}
      }
    }
  }
}
